id,name,host_name,host_since,host_acceptance_rate,host_is_superhost,price
29047584.0,BEAUTIFULL APPARTEMENT IN THE CENTER !,Dylan,2017-12-13,80.0,False,265.25
29109257.0,Private room / studio / Indep. access / Healthcare,Evelyne,2017-09-13,100.0,False,49.0
29116163.0,Dauphinelles 12,Bernadette,2018-07-12,94.0,False,169.0
29116174.0,Fleur des Champs,Bernadette,2018-07-12,94.0,False,291.0
29116184.0,Héloïse,Bernadette,2018-07-12,94.0,False,299.0
29129884.0,Appartement cosy dans un chalet privé,Anne-Catherine,2017-05-30,100.0,False,172.0
29140584.0,"Aux 3 hirondelles, par les airs le lac ou la route",Jean Richard,2018-10-09,100.0,True,190.0
29199253.0,Chalet familial au coeur du Pays d'Enhaut,Vincent,2016-11-25,100.0,False,250.0
29200903.0,Bright appartement in Lausanne centre,Myriam,2016-06-21,96.5,nan,142.5
29213853.0,Appartement lumineux avec terrasse vue sur Lac,Orphane,2018-06-04,62.5,False,171.25
29232240.0,Montreux Castle -Studio 2 Beds -Lake view terrasse,Georges,2018-03-19,100.0,True,133.0
29237387.0,Luxury 4BD Apartment Montreux Center & Lake View,Julian,2015-09-09,100.0,False,894.0
29254664.0,Chalet les Pavots,Chantal,2018-10-13,90.0,False,340.0
29275635.0,"Lake Geneva, the Lavaux and the Swiss Alps",Juergen,2015-06-28,95.75,False,153.75
29281952.0,Lovely flat a stone's throw from the Cathedral,Juliette,2016-05-04,61.5,False,68.0
29326876.0,Very close to Lausanne: single family home,Violaine,2010-12-10,0.0,False,243.5
29331041.0,"Agritourism, Farm Market, EHL",Philippe,2015-10-09,82.0,False,329.75
29345988.0,Bel appartement avec super vue,Maxime,2015-05-11,85.5,False,122.0
29363558.0,"203 Morges centre,  chambre neuve",Maria,2017-04-20,90.0,False,341.25
29380151.0,Très joli appart. tranquille de 1.5 pcs + parking,Marcos,2018-10-18,93.25,False,211.25
29383323.0,APPARTMENT WITH 3.5 ROOMS AND GARDEN,Swiss,2017-05-04,82.0,False,200.0
29387705.0,Gîte du Campanile chambre Lila,Pascale,2018-10-18,97.0,True,85.0
29411892.0,Cozy desk apt in Lausanne city,Mag,2012-10-23,80.0,True,363.0
29434032.0,Lausanne centre ville,Milan,2015-07-02,95.75,False,140.25
29514775.0,Penthouse studio 30m2 ☆ Terrace & Parking,Lena,2016-04-03,90.0,True,55.0
29530434.0,"Family, cosy, spacious and very bright apartment",Wilcimar - Sabrina,2016-06-15,88.0,True,87.0
29559465.0,Lovely 1BR Apartment - Lausanne Center,Marc,2012-09-10,90.0,False,315.5
29580529.0,"Ideal location, Ouchy",Skander,2015-03-22,85.5,False,101.25
29581872.0,Cozy 1-bedroom apartment in Lausanne city,Tammy,2018-10-26,93.25,False,130.0
29586810.0,"Maison, étang, grand jardin, verger, cheminée",Philippe,2015-10-09,82.0,False,200.0
29587410.0,Cottage de Vully on the lakeshore,Seline,2017-04-11,88.75,False,329.0
29588487.0,"Luxury and charming renovated apartment, Lausanne",Annemarie,2017-08-03,45.0,False,125.0
29604169.0,Amazing flat and view close to the city centre!!,Cyril,2015-03-30,86.0,False,101.25
29650294.0,Chambre dans un appartement avec vue lac,Magali,2018-10-29,93.5,False,130.0
29650642.0,Charming chalet in the middle of the pastures,Véronique,2018-10-29,86.0,False,230.0
29663591.0,Givrins: grand appartement à 10 min de Nyon,Heidi,2018-10-30,70.75,False,130.0
29695918.0,Au coeur de Lausanne: appartement avec terrasse,Melanie,2013-12-20,80.0,False,154.25
29704810.0,"Studio chalet du Bonheur ***, 1 ou 2 personne/s",Nadine,2018-03-21,100.0,False,180.0
29723803.0,Superior Lake Stay,Minara,2016-12-26,75.0,False,216.25
29745986.0,Vevey - Nid d'aigle - Location d'une année,Laura,2018-11-02,69.25,False,125.0
29752920.0,Griffon 05,Bernadette,2018-07-12,94.0,False,216.0
29825799.0,Rougemont Zuhause mit Traumaussicht,Martina,2014-05-13,100.0,False,118.0
29861570.0,Studio d’un charme campagnard,Christine,2014-08-20,42.5,False,212.0
29926957.0,"Pretty, quiet, central attic apartment",Madeleine,2015-12-01,20.0,False,125.0
29971549.0,Lausanne Home with a View,Christopher,2014-07-08,50.0,False,188.75
29979779.0,"Exceptional modern flat with view, Lake and Alpes",Stephan John,2014-09-23,70.0,False,219.0
29987948.0,Studio in Chernex-sur-Montreux with fantastic view,Olga,2018-11-12,0.0,False,120.0
30030200.0,Appartement ensoleillé au centre de Lausanne,Swiss,2017-05-04,82.0,False,120.0
30102037.0,Montreux home with a view,Inez,2014-05-21,0.0,False,490.0
30102559.0,"Central, friendly apartment - fully equipped",Richard,2017-08-20,100.0,False,300.0
30106310.0,Bright artist studio with its view of the lake,Sarah,2014-12-13,56.5,False,122.0
30107580.0,"Charmant appartement, centre de Villars, parking",Richard,2017-08-20,100.0,False,300.0
30126146.0,2 bed rooms in a beautiful apt / center lausanne,Salvatore,2013-01-28,92.5,False,473.25
30241748.0,Les Mosses-Motel 4 app. 2.5 pces très bien situé,Angela,2018-02-27,50.0,False,100.0
30281911.0,Chambre calme et lumineuse,Atef,2016-03-30,0.0,False,127.0
30282606.0,Charmante Villa a proximité de Lausanne,Thomas,2016-07-14,43.25,False,88.75
30340620.0,Appartement simple et confortable,Fabienne,2018-09-12,94.0,False,220.0
30341649.0,Entre vignes et lac Léman.  Vue sublime sur le lac,Coudrast,2014-08-20,100.0,False,240.0
30372536.0,Leysin | Lovely Alpine Flat,Ifti,2017-03-29,100.0,False,79.0
30410149.0,"Close ski, 2 rooms, 2 bathrooms, magnificent view",Sofia,2017-03-24,86.0,False,102.0
30439669.0,Appartement,Vyatcheslav,2017-12-09,80.0,False,265.25
30517137.0,Great View spacious 3 BR flat with Pool and Gym,Moriya,2012-06-28,51.0,True,433.0
30519102.0,Studio a 5 minutes du centre de Montreux.,Esther,2018-12-04,68.5,False,292.5
30529901.0,"Grand et jolie chambre , spacious and cosy room",Judith,2017-03-26,80.0,False,71.0
30558639.0,"Appartement 2pièces neuf bien agencé, bien situé !",Guy,2016-08-08,96.25,False,101.0
30571370.0,Maison au calme sur la riviera,Guillaume,2016-05-11,67.0,False,94.5
30580434.0,"117 * Bright, classic and elegant, close to train",Bomood,2013-08-25,95.0,False,207.0
30637958.0,"Studio calme et cosy, proche du centre-ville",Julie,2014-08-09,0.0,False,60.0
30680980.0,Apartment 5 minutes from the train station,Ali,2016-09-28,98.0,False,175.0
30692119.0,Super Luxury Serviced Apartment next to Gstaad,Moriya,2012-06-28,51.0,True,245.75
30720428.0,Ouchy - bord du lac- Joli appartement avec jardin,Anne-Laure,2015-02-27,65.5,False,100.5
30726984.0,Cosy apartment,Sandra,2014-07-17,72.75,False,107.5
30728674.0,beach house,Fabrice,2016-01-04,55.0,False,800.0
30729894.0,Montreux - Riviera-lac-Festival !,César,2016-04-24,0.0,False,58.5
30798049.0,Keur fall,Mamadou,2016-06-13,88.75,False,112.5
30809593.0,Double Room Vaudaire,Véronique Louise,2012-08-29,73.0,False,245.75
30809599.0,BORNAND,Véronique Louise,2012-08-29,73.0,False,245.75
30815673.0,Christmas Time around Lausanne,Cornelia,2015-05-21,88.25,False,108.5
30833804.0,"Belle chambre à 2 pas du lac, du bus et du métro",Véronique,2017-11-18,84.25,False,100.25
30883046.0,Simple chalet on the ski slopes,Daria,2018-12-09,100.0,False,625.0
30883782.0,Lovely apartment with a stunning view,Daria,2018-12-09,100.0,False,260.0
30941658.0,"Appartement 1,5 pièce T1 bis, 10min de Lausanne",Estelle,2015-02-13,65.5,False,100.5
30947845.0,Joli chalet de charme avec cheminée,Carine,2018-12-18,0.0,False,220.0
31008501.0,Designer urban jungle apartment in center Lausanne,Sheherazade,2018-12-20,66.75,False,342.5
31068537.0,"Apparemment 2 pièces neuf, lumineux et bien situé",Guy,2016-08-08,100.0,False,132.0
31096679.0,"Grand appartement moderne, avec chat à s occuper",David,2018-06-07,62.5,False,151.25
31147561.0,Le charme de la campagne aux portes de Lausanne,Raoul,2018-12-27,46.0,False,198.75
31189486.0,Beautiful Spacious Room in Morges!,Dima,2018-11-25,74.0,True,65.0
31197184.0,Wonderful terrace mountains and lake view,Roman,2017-06-12,100.0,False,152.0
31197663.0,"Apartment central top floor, 2 bedroom, 1 bath",Roman,2017-06-12,100.0,False,139.0
31207182.0,Grand studio idéalement situé,Virginie,2016-04-29,66.0,False,53.5
31215522.0,App duplex luxueuse vue splendide plein sud (75m2),Benjamin,2018-07-16,0.0,False,140.0
31216817.0,Appartement vue panoramique proche centre-ville,Jolanda,2013-10-18,25.0,False,160.0
31240905.0,Studio avec cuisine,Jonas,2018-10-25,100.0,False,80.0
31248070.0,2-bedroom apt with panoramic view on the lake,Yann - Olivier,2012-06-29,75.5,False,300.0
31253914.0,Hottub! garden! 2bedrooms +2bathrooms,Yasmine,2017-11-09,98.0,True,126.0
31263020.0,Lausanne -Private apartment with terrace,Fernando,2013-07-15,69.75,False,194.5
31300584.0,Beautiful Chalet in Rougemont,Ben,2019-01-04,61.25,False,119.5
31310721.0,Cozy renovated Chalet in Rougemont/Gstaad,Chantal,2019-01-04,67.0,False,265.0
31313081.0,"Charme, confort d'une maison entre lac et montagne",Laetitia,2018-01-15,63.5,False,421.25
31322945.0,Cozy Family House | near subway station.,Nichaon,2016-03-04,38.5,False,168.25
31327701.0,Big and luminous room with balcony and lake view,Sou,2015-01-20,44.0,False,106.25
31344341.0,Studio in ehemaligem Bauern -Reihenhaus im Dorf,Etienne,2018-03-30,100.0,True,131.0
31347517.0,The best location in Lausanne,Roxana,2012-04-29,75.5,False,245.75
31349571.0,Appartement @ the best location in Lausanne,Roxana,2012-04-29,75.5,False,245.75
31353721.0,Chambre à la Confrary en campagne,Claire-Lise,2019-01-06,17.0,False,50.0
31375510.0,Private room with view on the lake Léman,Christophe,2015-04-29,76.0,True,154.75
31379753.0,Habitacion,Sandy,2018-12-31,36.25,False,158.75
31380081.0,Casa de familia,Sandy,2018-12-31,36.25,False,158.75
31392105.0,Charming house in great location!!,Nichaon,2016-03-04,38.5,False,168.25
31424842.0,Chambre dans un appartement à 10min centre ville,Kantarena,2016-06-02,88.75,False,112.5
31479241.0,Appartement - Le Pralet,Valéry Et Nicole,2019-01-11,61.0,False,100.0
31515089.0,Joli appartement spacieux proche du lac,Reb,2015-08-01,89.5,False,399.5
31521203.0,Modern and spacious studio,Gabriela,2014-10-14,79.0,True,90.0
31559141.0,Spacious room close to Montreux with stunning view,Antoine,2019-01-14,90.25,False,69.5
31589531.0,New studio for weekends in beautiful Lausanne,Swen,2014-02-23,81.25,False,125.25
31603354.0,"Chalet in the Swiss Alps, Leysin",Sarah,2016-10-01,95.0,False,166.5
31604139.0,Cozy apartment with stunning view! Ski-in/ski-out.,Christina,2016-12-31,100.0,False,320.0
31614165.0,Bienvenue à Nyon,Diana,2019-01-16,100.0,False,63.0
31617691.0,Les libellules,Anne,2015-05-06,100.0,False,69.0
31645150.0,"2 rooms+living room, 6 pax.,old town 3 min.by foot",Sylvie & Pierre-Antoine,2019-01-17,100.0,False,77.0
31704347.0,"☆Apartment 2 bedroom, city centre, Montreux view ☆",Roman,2017-06-12,100.0,False,174.0
31705185.0,Sweety apartment 55 meters 2,Barth,2017-09-28,50.0,True,101.0
31727113.0,Double room,Dominique,2014-03-18,75.0,False,119.0
31730635.0,"Studio à Louer à Renens, Proche de Lausanne centre",Vlo,2016-01-20,74.75,False,342.5
31732335.0,Studio avec cachet,Elisabeth,2019-01-21,100.0,True,65.0
31755857.0,Super belle chambre à 2 min de la gare de Lausanne,Chiara,2015-12-25,0.0,False,70.0
31803282.0,Appartement au centre ville de Lausanne. Suisse,Mar,2019-01-22,73.0,False,76.25
31816035.0,CHALET A LA MONTAGNE - Villars sur Ollon,Virginiepisler,2018-02-06,71.0,False,350.0
31828206.0,Sofabed in hall,Durai,2016-07-06,72.0,False,157.25
31829391.0,Spacieux appartement dans une ferme rénovée,Fabien,2012-10-18,100.0,False,120.0
31831429.0,HÔTEL RESTAURANT FRENCH75  BRESSONNAZ,French,2019-01-23,46.0,False,90.0
31845575.0,Studio avec jardin,Crystel,2018-11-01,91.0,False,60.0
31872742.0,Beautiful room at the harbour of Vevey,Fairgrieve,2014-12-20,83.0,False,70.0
31921338.0,Spacious apartment in a peaceful neighbourhood.,Emilia,2014-05-22,57.75,False,150.0
31925702.0,180° Mountain view - Close to Vevey,Madeline,2014-09-07,68.0,False,186.0
31926555.0,"In Pully, the best location !",Laia,2019-01-27,72.75,False,76.25
31954163.0,Appartement cosy et lumineux en ville de Lausanne,Estelle,2014-01-24,100.0,False,119.25
31954252.0,"Heimeliges, sonniges Zimmer mit Privatbad",Therese,2019-01-28,99.0,True,60.0
31957583.0,Appart lutry view,Stéphane,2019-01-28,72.75,False,76.25
32001130.0,Private Room for Solo or couple,Dave,2016-04-19,99.0,True,64.0
32033137.0,Fancy Studio,Kelly,2012-05-25,100.0,False,130.0
32063400.0,Appartement a 15 minutes du lac,Sebastien,2012-05-06,100.0,False,245.75
32083236.0,Cosy and Charming Loft on the height of Lausanne,Annemarie,2017-08-03,45.0,False,115.0
32087866.0,"Chalet Alderaan, Bed and Breakfast.",George And Carol,2014-06-18,91.0,True,55.0
32098487.0,HÔTEL RESTAURANT FRENCH75 BRESSONNAZ,French,2019-01-23,46.0,False,90.0
32109421.0,Montreux - Lac Léman - Christmas market,Tatiana,2017-02-23,86.0,False,79.75
32127789.0,La pelote à Fenalet sur Bex,Céline,2017-03-16,100.0,True,68.0
32182977.0,Ferme rénovée entre lacs et montagnes,Sabine,2014-09-11,0.0,False,329.0
32275603.0,Relaxing-Silent-Near the City-Natural-House.,Bertrand,2019-02-10,97.0,False,75.0
32297504.0,Appartement avec vue Lac et Montagnes,Lolo,2015-04-17,88.25,False,128.5
32321501.0,"Le Chalet, Mont-Pelerin",Jean Luc,2015-12-03,100.0,True,190.0
32321901.0,BEAUTIFULL APPARTEMENT IN THE CENTER !!,Dylan,2019-02-12,97.0,False,75.0
32350975.0,"Chambre ""Cerise"" avec piscine et jardin",Christine,2019-02-13,100.0,False,55.0
32383087.0,Appartement familial,Cassandre,2012-04-21,100.0,False,245.75
32414949.0,Chalet Susabel Ski Lodge Villars sur Ollon,Simon,2016-01-09,75.0,False,400.0
32415305.0,"Superbe logement, vue sur le lac et les montagnes",Aline,2019-02-04,86.25,False,67.5
32433426.0,Clos Belin,Roger,2017-02-03,64.0,False,130.0
32454081.0,Calme et proche de tout - Appartement indépendant,Adrien,2015-11-13,78.5,False,132.5
32511785.0,"""Swiss Lake Lodge""  bordering the Lake of Geneva",Nicolas,2013-02-15,91.0,True,850.0
32513363.0,"Top Appart 2 pces au centre (calme, dernier étage)",Nicolas,2017-08-24,55.0,False,177.0
32547615.0,"Chambre ""Lavande"" avec piscine et jardin",Christine,2019-02-13,100.0,False,65.0
32558152.0,Beautiful attic room with stunning lake view,Stefan,2013-09-26,69.75,False,184.5
32638348.0,Chambre a louer dans un endroit calme en ville,Maude,2016-11-25,67.25,False,361.0
32654769.0,Private room with shower and separate entry.,Olga Angelika,2013-08-14,95.0,True,184.5
32678722.0,Spacious room in a shared flat,Benjamin,2015-05-11,91.0,False,234.5
32730196.0,Cozy studio in Lausanne center,Elena,2014-05-27,40.0,False,90.0
32735176.0,"Montreux Jazz, vue lac et Alpes,musée Chaplin",Anouk,2019-03-01,0.0,False,55.0
32736784.0,Superbe Studio à Lausanne Proche Epfl et Unil,Stéphane,2014-04-05,100.0,True,118.0
32764956.0,"Chambre lumineuse, vue lac.",Camille,2017-06-25,96.0,True,68.0
32784392.0,Lac Léman - en Suisse- Clarens-,Maria,2019-02-20,96.75,False,97.25
32785628.0,Jolie chambre lumineuse proche de la gare,Lauren,2012-10-17,100.0,False,350.0
32805126.0,Home sweet Home,Lorella,2015-07-11,74.0,False,212.25
32854680.0,Chambre + sdb privée dans belle villa avec jardin,Emilie Judith Marie,2014-08-21,93.0,False,85.0
32855681.0,Nice cozy flat with beautiful view in Lausanne,Dani,2013-08-11,64.0,True,111.0
32877946.0,"App rénové  90m2 3.5p., 32m2 terrace lake view",Olivier Et Caroline,2017-01-18,100.0,False,284.0
32880868.0,Duplex de charme à Coppet,Laurence,2019-03-07,100.0,False,150.0
32881188.0,Perfect family home near lake,Anne-Sandra,2013-04-16,26.0,False,300.0
32890213.0,L'Observatoire (The Observatory) - city center,Marc-Antoine,2019-03-07,73.75,False,108.5
32904798.0,Petit Concon en face du Lac,Jean-Claude,2019-03-08,73.75,False,80.0
32911254.0,Cosy flat in Lausanne!!!,Andres,2016-03-03,56.0,False,90.0
32954261.0,"Nids douillet dans les prés, entre lac et montagne",Antoine,2014-09-07,43.0,False,141.0
33011689.0,Magnifique appartement avec vue sur le lac leman,Claudia,2018-04-15,90.75,False,106.5
33056837.0,Chalet Maurice by Interhome,Melinda - Interhome Group,2016-10-28,94.0,False,720.0
33057081.0,Diamant 6 by Interhome,Melinda - Interhome Group,2016-10-28,94.0,False,212.0
33057181.0,Savoie 1 by Interhome,Melinda - Interhome Group,2016-10-28,94.0,False,155.0
33058672.0,Sunset B 11 by Interhome,Melinda - Interhome Group,2016-10-28,94.0,False,660.0
33059943.0,Ferme Bio La Gottalaz,Zwyssig,2016-09-02,100.0,True,159.0
33086167.0,"Close to Geneve, Nyon,  7 min walk to lake - room1",Sinaya,2018-01-04,42.0,False,350.0
33112661.0,Beautiful studio 2 minutes from the train station,Swiss,2019-02-19,89.0,False,120.0
33136368.0,Beautiful duplex in Vevey centre,Kristina,2017-03-09,70.0,False,87.0
33154240.0,Chambre à louer dans un environnement calme.,Olivier,2017-09-13,50.0,False,54.0
33154869.0,Logement spacieux pour un séjour dans le calme.,Olivier,2017-09-13,50.0,False,54.0
33188715.0,Suite au centre du village de St-Cergue,Ursula,2019-03-19,100.0,False,90.0
33206990.0,HOTEL AGORA SWISS NIGHT - STUDIO WITH KITCHENETTE,Hotel Agora Swiss Night,2019-03-20,100.0,False,93.75
33235436.0,"Magnifique chambre , chez nous c’est chez vous",Victoria,2019-03-21,99.25,False,93.75
33249653.0,Chalet Floriana,Cathy & Patrick,2015-10-09,100.0,True,150.0
33306572.0,Chambre privée à Morges,Paul,2014-11-01,63.75,False,143.5
33311862.0,"Lost Paradise Montreux ! You’ll love it !2,5 rooms",Aimée,2016-03-06,0.0,False,122.5
33314767.0,Good vibes contemporary family home in an old barn,Audrey,2016-02-07,67.25,False,93.75
33339917.0,Appartement neuf et lumineux au centre de Vevey,Noémie,2019-03-25,99.25,False,110.0
33351595.0,Renovated chalet with 3 bedrooms and 2 bathrooms,Lpm,2017-08-03,92.0,False,283.0
33357502.0,Beautiful room in a quiet center area,Nicolas,2017-03-13,70.0,False,87.0
33370309.0,Vielle ville Vevey avec terrasse sur le toit,Susanne,2016-08-16,93.75,False,197.5
33415952.0,Studio calme au centre de Lausanne,Solène,2017-02-28,86.0,False,79.75
33488135.0,L'Alpage - Stylish chalet apt in the Swiss Alps!,Alexander,2018-05-18,71.0,False,118.25
33512362.0,Private room 2 - single bed,Ingrid,2016-04-26,98.0,True,55.0
33521704.0,Petit Paradis 2..face au lac au milieu des vignes,Andre,2018-07-17,100.0,True,189.0
33565556.0,Swiss Wine Hotel - séjournez au cœur de la ville,Hotel Swiss Wine,2016-10-06,100.0,False,174.0
33613346.0,Petit Paradis1..face au lac au milieu des vignes.,Andre,2018-07-17,100.0,True,225.0
33673217.0,"Lac Leman,Roussy,Vevey,Gare, Migros et Coop....",Pili,2016-05-31,91.75,False,303.0
33679509.0,Beautiful apartment entirely renovated,Eduardo,2018-09-09,71.5,False,375.0
33683855.0,Nice flat located between Vevey and Montreux,Olivier,2016-05-30,100.0,False,219.0
33730908.0,Chambre twin vue jardin/Twin room garden view,Hôtel Alpha-Palmiers,2019-03-18,97.0,False,105.25
33743994.0,Chambre avec vue sur lac de Morat,Soizic,2016-08-24,93.75,False,197.5
33760381.0,Ferien direkt am Murtensee - im Chalet in Salavaux,Christian,2018-12-03,84.0,True,120.0
33760588.0,Appartement cosy sur le balcon du Léman,Philippe,2019-04-10,98.0,False,212.25
33818541.0,On the ski slops Small chalet in the Alps,Brock,2016-10-06,99.0,True,132.0
33823828.0,Appartement dans un beau Chalet,Claudia,2018-06-27,100.0,False,140.0
33842018.0,Jolival appartement vue sur lac et montagnes,Olivier & Rose-Marie,2017-04-14,88.0,False,180.0
33846410.0,Chambre dans villa au calme et proche de la nature,Hervé,2019-04-07,99.25,False,197.25
33904826.0,"Studio avec terrasse,vue imprenable sur le lac",Myriam Et Julien,2019-02-27,98.0,True,149.0
33925451.0,Hotel Swiss Chocolate - Chambre twin/double,Hôtel Lausanne By Fassbind,2015-12-26,100.0,False,177.0
33939377.0,"Joli 2,5 p. meublé avec jardin à sous louer",Jenny,2017-03-31,0.0,False,130.0
33948260.0,Hotel Swiss Chocolate - Chambre single,Hôtel Lausanne By Fassbind,2015-12-26,100.0,False,234.0
33949362.0,Hotel Swiss Chocolate - Chambre familiale,Hôtel Lausanne By Fassbind,2015-12-26,100.0,False,618.0
33952308.0,"next to Geneve & Nyon, close to the lake room 2",Sinaya,2018-01-04,42.0,False,485.0
33956299.0,"Home sweet home (2 rooms, 3 people, Vevey center)",Laurence,2019-04-17,98.0,False,319.0
33963112.0,Modern Apartment in Alps with Stunning View,Gerald,2013-04-01,0.0,False,354.5
34048777.0,"""Agate 53"" à Villars-sur-Ollon",Mélanie,2017-12-17,80.0,True,100.0
34073472.0,Chambre double supérieure “Au bonheur des Iris”,Christine,2016-12-01,75.0,False,150.0
34138312.0,Studio Valentin Centre Ville,Maxime,2015-02-04,93.0,False,95.0
34148863.0,"Spacious, bright and luxurious lakeside appartment",Nikola,2016-02-11,100.0,True,194.0
34178866.0,Lausanne,Lavoshan,2017-10-25,62.0,False,95.75
34238320.0,Great House with garden close to lake and forest,Ander,2012-09-09,56.75,False,97.25
34240554.0,Bel appartement 2  minutes centre ville,Jo & Mag,2011-12-29,75.0,False,142.75
34250739.0,Chambre a loué,Sara,2019-04-28,98.0,False,142.5
34255092.0,Great flat for 1/2/3/4 between Montreux & Vevey,Quentin,2016-10-14,96.75,False,168.25
34270231.0,Appartement de vacances,Isabelle Et Patrizio,2019-04-29,100.0,False,150.0
34270600.0,Chez Daniela,Daniela,2019-04-29,92.0,False,40.0
34274329.0,Parc Horizon,GIsela,2016-05-15,91.25,False,40.0
34298342.0,"Apartment Leman Lake, Olympic Muséum",Zak,2015-02-18,0.0,False,127.5
34301839.0,Jolie chambre & salle de bain privée dans villa,Robert & Antonella,2019-04-30,100.0,True,66.0
34305015.0,"*Cosy place nested between lake, vineyard & alps",Chris,2014-04-25,0.0,False,90.0
34310049.0,Appartement mansardé pour 2 à 6 personnes,Vincent,2016-08-16,100.0,False,197.5
34318335.0,"Cosy place nested between lake, vineyard & alps",Chris,2014-04-25,0.0,False,65.0
34320905.0,"Saint-Sulpice : studio avec vue, à deux pas du lac",Nathalie,2019-05-01,98.0,False,142.5
34339065.0,Modern appartment in the center of Villars,Karin,2019-05-01,100.0,True,314.0
34347800.0,Loft d'artiste à Lausanne,Elena,2015-03-04,91.0,False,170.0
34392888.0,La Petite Maison Près de la Forêt,Lili,2019-02-15,96.75,False,97.25
34467742.0,Loue,Manuela,2018-01-11,66.0,False,500.0
34493362.0,Lovely family flat in Lausanne Chailly,Betty,2014-06-30,38.0,False,200.0
34499808.0,Appartement d'exception à 2 pas du lac,Marc,2019-05-07,85.0,True,151.0
34531837.0,Modern appartment in the center next to the lake,Maria,2019-02-08,94.5,False,87.5
34538486.0,Spectacular Home - Minutes from Montreux/Vevey,Marlene,2017-03-01,66.0,False,94.5
34541861.0,Big room in Beautiful duplex near Nyon,Mary Jean,2015-07-17,64.0,False,65.0
34548617.0,Chalet Vicky et Nino,Nino,2016-08-22,100.0,False,130.0
34561180.0,VEVEY Nice double room in cosy flat 50m from  lake,Damien,2017-10-31,69.5,False,107.25
34595978.0,"Cosy room for 1-2 persons in Montreux, nice view",Laura,2014-05-09,48.0,False,95.0
34643904.0,3.5 pièces confortable. Panorama sur les Alpes,Olivier,2016-01-31,99.0,True,100.0
34663629.0,Bed&Breakfast situation exceptionnelle face au lac,Maria,2019-05-13,100.0,True,184.0
34711080.0,"Modern apartment, near center, free parking",Christopher,2015-08-13,65.0,False,655.0
34715417.0,Studio au centre ville à deux minutes de la gare,Félicien,2017-07-28,57.25,False,234.75
34721601.0,Stunning Swiss Chalet.,Kelly,2016-11-03,0.0,False,750.0
34729468.0,Chambre étudiante proche de l'EPFL,Pierre-Jean,2019-05-15,71.25,False,156.25
34793658.0,Montreux cocoon : cosy Apartment with Lake Views,Sara,2013-08-22,100.0,False,260.0
34801896.0,Charmant appartement à 2 pas de Lausanne,Camille,2011-08-05,64.25,False,554.25
34807842.0,Chalet sur deux étàges privés 260m2,Claudia,2018-06-27,100.0,False,303.0
34825627.0,"Room in shared flat at EPFL, balcony+lakeview",Oskari,2019-04-18,98.0,False,192.25
34850266.0,Modern apartment near Lausanne and Vevey,Vera & Guillaume,2013-08-29,89.0,False,320.0
34864448.0,Luxurious apartment on the Swiss Riviera.,Nick,2013-06-08,72.0,True,175.0
34878536.0,32-Private Room+storage+lake view 3min to Metro,Christian,2018-04-26,63.0,False,58.0
34904004.0,FÊTE DES VIGNERONS PROCHE DE VEVEY,Ana Claudia,2014-10-03,43.0,False,139.0
34943464.0,"Séjour dans une maison rustique, pleine de charme.",Mary,2019-05-21,100.0,True,61.0
34950438.0,A LOUER CHAMBRE CHEZ L'HABITANT,Marie,2019-03-02,100.0,False,101.0
34968892.0,Charmant studio cosy - Lausanne,Kevin,2014-07-14,100.0,True,52.0
34970413.0,T@bby Vintage Caravan - Tiny Space in the Lavaux,Franziska,2013-12-02,86.0,True,94.0
34970464.0,Appartement à 10min de Lausanne (Lavaux),Sylvain,2019-05-22,77.5,False,293.75
34986279.0,"Agréable appartement de plein pied, près du centre",Christina,2016-12-31,100.0,False,196.0
34995646.0,洛桑市中心温馨三房Cosy 3.5Apart. in city centre of Lausanne,Jessica,2016-01-28,99.75,False,232.0
35028076.0,Large bedroom in a 90m2 apartment 10 min Lake,Niels,2014-06-10,84.5,False,114.75
35050254.0,3 pièce sous-gare vue sur le lac,Matthieu,2015-09-20,50.0,False,854.0
35066009.0,Pieds dans l'eau!,Edi,2014-03-31,0.0,False,157.0
35101095.0,Hameau de la gare B3 les diablerets,Stéphane,2019-05-27,77.5,False,250.25
35102683.0,Chambre à louer à Nyon - immeuble standing - gare,Rebeca,2018-01-14,66.0,False,357.5
35125702.0,Luminous big room + balcony near station and lake,Tamara,2015-11-24,94.0,False,65.0
35133083.0,Sous-location appartement,Begoña,2013-11-06,87.0,False,288.5
35139334.0,Sunday Morning,Guga,2015-09-19,50.0,False,854.0
35144390.0,Nice apartment Montreux and Leman view,Roman,2017-06-12,100.0,False,177.0
35146756.0,"Rentals by Laura - The ""Alpes"" apartment",Laura,2016-11-16,67.25,False,294.0
35212675.0,"Bright, Modern apartment in Old Town Lausanne",Rachel,2017-06-22,100.0,False,142.75
35274561.0,2 chambres c/habitant pour 1-2-3 ou 4 voyageurs,Carmen,2017-12-24,100.0,True,95.0
35284297.0,Central pretty apartment 55m2,Barth,2017-09-28,50.0,True,102.0
35295744.0,Comfortable flat quiet and secure zone.,Leonard,2012-11-15,60.0,False,93.0
35338438.0,Chambre privé - Petit salon - Terrasse - Parking,Gabriela,2019-06-29,42.25,False,136.0
35344187.0,Chambre spacieuse et cosy proche du lac,Michael,2014-06-19,100.0,True,68.0
35359614.0,Les Chênes - Studio en pleine Nature,Antoine,2014-10-14,43.0,False,163.5
