id,name,host_name,host_since,host_acceptance_rate,host_is_superhost,price
53232891.0,Amazing apartment overlooking the Lake,Vanessa,2016-05-24,50.0,False,245.5
53246855.0,"1 room apt, full kitchen, private patio",Christine,2021-11-09,100.0,True,100.0
53251478.0,"109* Stunning new studios by the lake, near Lausan",Bomood,2013-08-25,95.0,False,110.0
53276387.0,Chalet 6 pers. à 300m des pistes,Chris,2021-09-22,100.0,False,120.0
53279125.0,Spacious room with detached private bathroom,Gonz,2015-11-15,87.0,False,55.0
53306878.0,"VILLARS SUR OLLON appart 110m2 , balcon sud 1er ét",Sylvie,2021-11-12,100.0,False,322.0
53322314.0,Appartamento in centro a Losanna: 1 camere,Claudio,2011-10-23,86.25,False,150.0
53330468.0,LOFT chambre salon vue lac plein centre Lausanne,Ambers,2018-04-27,75.0,False,75.0
53334489.0,Appartement plein centre de Mies,Ronald,2013-10-22,98.0,True,150.0
53349031.0,La Chambre Bleue,Sky-Zone Attitude,2021-04-26,100.0,False,51.0
53360819.0,Marvelous Luxurious Furnished Flat with Outstandin,Moriya,2012-06-28,51.0,True,988.0
53388750.0,Loft chaleureux et artistique,Denis,2022-07-06,56.25,False,175.0
53389925.0,"Magnifique villa, jacuzzi, Garage, fitness, lift.",Ben,2016-08-04,0.0,False,80.0
53424323.0,Lovely studio - 944000,Homenhancement,2019-07-05,59.0,False,138.25
53424656.0,Cosy appartement en résidence,Marie-Noëlle,2015-06-24,33.0,False,135.5
53426719.0,"Les Hirondelles, magnificent view on the mountains",CoucouNCo,2016-09-11,100.0,False,143.0
53427241.0,Superbe appartement avec vue imprenable sur le lac,Patricia,2016-04-17,100.0,True,190.0
53430111.0,Beautiful 1 bedroom apartment in Pully,Bernardo,2017-08-22,59.25,False,132.0
53430800.0,Appart. dans maison villageoise - 1 à 2 personnes,Gérald,2021-11-19,100.0,True,90.0
53431220.0,Agréable chambre indépendante avec salle de bains,Gérald,2021-11-19,100.0,True,60.0
53444409.0,"Chambre dans les combles, endroit très calme",Cédric,2021-11-20,100.0,True,77.0
53454684.0,Superbe appart avec vue panoramique sur le Léman,Elsa,2016-09-24,60.0,False,120.0
53455920.0,apartment in the center with an amazing view,Laurent,2015-04-23,100.0,True,120.0
53457975.0,Lovely 1 bed condo in historic town + free parking,Barbara,2021-11-21,85.0,True,76.0
53477531.0,Superbe appartement avec terrasse et jardin,Angy,2015-10-10,100.0,False,85.0
53496144.0,"Lausanne apartment, ideal for 2 (up to 4) people",Nina,2016-09-30,63.5,False,369.0
53506906.0,Beautiful villa with a view on Geneva lake-Lausann,Anastasia,2019-10-10,63.0,False,420.0
53520446.0,Private Single Room | Montreux Youth Hostel,Montreux Youth Hostel,2021-10-27,96.0,False,70.0
53521071.0,Private Twin Room | Montreux Youth Hostel,Montreux Youth Hostel,2021-10-27,96.0,False,140.0
53521125.0,Private 4-Bed Room | Montreux Youth Hostel,Montreux Youth Hostel,2021-10-27,96.0,False,240.0
53521206.0,Private 6-Bed Room | Montreux Youth Hostel,Montreux Youth Hostel,2021-10-27,96.0,False,216.0
53521316.0,1 Bed in 6-Bed Mixed Dorm | Montreux Youth Hostel,Montreux Youth Hostel,2021-10-27,96.0,False,36.0
53521637.0,The Kite in Villars,Christine,2016-01-10,100.0,False,190.0
53521965.0,Lovely 1bedroom apartment in the heart of Lausanne,Yondaime Baldric,2017-06-27,0.0,False,150.0
53554134.0,Spacious apartment with panoramic view,Thierry,2017-05-01,100.0,True,270.0
53563396.0,Pré Vert 3 by Interhome,Melinda - Interhome Group,2016-10-28,94.0,False,463.0
53569396.0,Mountain View near Station,Neal,2021-07-19,40.0,False,201.25
53572333.0,Lakeside Appartement avec terrasse et vue,Bestbnb,2019-08-27,100.0,nan,345.0
53582839.0,Completely renovated Chalet dating from 1749!,Patrick,2015-04-22,80.0,False,189.0
53584592.0,"Petite chambre dans les combles, endroit calme",Cédric,2021-11-20,100.0,True,67.0
53616709.0,Bright & cosy studio in the ❤ of Leysin,Ana,2018-05-30,0.0,False,101.25
53620259.0,"Bel appartement de 2,5 pièces avec jardin",Philippe,2016-07-05,46.0,False,120.0
53655936.0,Gorgeous Chalet Apartement with great view,Ulrike,2015-12-10,100.0,False,320.0
53694214.0,Nyon- New 1 bedroom flat with balcony and parking,Annabel,2014-06-23,69.0,True,89.0
53696623.0,Ouchy - Magnificent 100m2 apartment  in Lausanne,Mauricio,2014-02-02,100.0,False,200.0
53712058.0,Grenat 8 by Interhome,Melinda - Interhome Group,2016-10-28,94.0,False,100.0
53712394.0,Charmant duplex avec jardin,Etienne,2014-11-09,100.0,False,190.0
53731394.0,"Appart. 3 chambres, calme et cosy, vue magnifique!",Miyuki,2016-05-22,100.0,False,250.0
53753683.0,Beautiful bedroom close to EPFL with free parking,Sarah,2018-10-14,92.0,False,60.0
53776372.0,Luxury Eco Chalet in Gryon,George,2014-08-04,83.0,True,93.0
53803638.0,Single room with shared bath|Avenches Youth Hostel,Avenches Youth Hostel,2021-10-27,100.0,False,70.0
53803662.0,Lovely 3 bedroom unit with great view + fire place,Niki,2015-02-19,0.0,False,420.0
53819397.0,Double room with bath | Avenches Youth Hostel,Avenches Youth Hostel,2021-10-27,100.0,False,95.5
53819698.0,2-Bed room with shared bath|Avenches Youth Hostel,Avenches Youth Hostel,2021-10-27,100.0,False,95.5
53819949.0,4-Bed room with shared bath|Avenches Youth Hostel,Avenches Youth Hostel,2021-10-27,100.0,False,53.0
53820152.0,6-Bed Room with shared bath|Avenches Youth Hostel,Avenches Youth Hostel,2021-10-27,100.0,False,44.5
53820397.0,Single Bed in a 4-Bed dorm | Avenches Youth Hostel,Avenches Youth Hostel,2021-10-27,100.0,False,95.5
53820552.0,Single Bed in a 6-Bed dorm| Avenches Youth Hostel,Avenches Youth Hostel,2021-10-27,100.0,False,36.0
53820628.0,Single Bed in a 8-Bed dorm | Avenches Youth Hostel,Avenches Youth Hostel,2021-10-27,100.0,False,36.0
53821495.0,Astra Hotel Vevey Studio 1,Christophe,2021-12-13,100.0,False,267.0
53825819.0,"Appartement charmant , avec vue panoramique",Guilhem,2021-12-14,60.0,False,110.0
53835877.0,Meilleur logement de Vevey,Prince,2017-01-26,30.0,False,66.0
53836395.0,Mine d'or,Prince,2017-01-26,30.0,False,85.0
53845174.0,Chalet pour amoureux de la nature,Milo,2013-06-17,80.25,False,124.25
53854159.0,Astra Hotel Vevey Studio 2,Christophe,2021-12-13,100.0,False,267.0
53877345.0,Lausanne: Superbe appartement avec vue sur le LAC,Sandy,2014-07-09,100.0,False,80.0
53883861.0,Stylish & Cozy Central Studio Ideal for Long Stays,Valérie,2014-12-10,97.0,True,199.0
53886282.0,Très bel appartement dans la verdure avec vue,Geneviève,2021-12-18,100.0,False,195.0
53886493.0,Logement entier : Appartement de charme,Lucas,2018-04-17,100.0,False,125.0
53895831.0,Chalet avec vue exceptionnelle aux Diablerets,Arlette Et Philippe,2015-11-30,93.0,True,133.25
53915427.0,Le studio de 💕Heidi 🇨🇭,Sonia,2017-01-01,99.0,False,69.0
53928713.0,Magnifique vevey,Prince,2017-01-26,30.0,False,64.0
53928756.0,Ultra propre et calme,Prince,2017-01-26,30.0,False,70.0
53933536.0,Superbe appartement en résidence avec cheminée.,Paola,2021-12-21,100.0,True,67.0
53976845.0,Bel appartement en montagne.,Alberto,2021-12-24,88.0,False,85.0
53978543.0,Superbe appartement sous les toits,Asli,2021-12-24,27.0,False,140.0
53995115.0,New studio apartment with stunning mountain views,Paolo,2013-01-17,77.0,True,90.0
53995931.0,Spacious cosy appartement w. garden - Villars' top,Valérie,2021-12-25,100.0,False,185.0
54008693.0,La perle rare,Prince,2017-01-26,30.0,False,65.0
54032113.0,Gd Duplex rénové hypercentre -Les gîtes de Clément,Clement,2012-04-15,94.0,False,192.0
54053855.0,Central & Luxury: 5BR Artistic Apartment,Titus,2015-05-01,100.0,True,131.0
54064193.0,Appartement 1 chambre,Base,2020-05-21,67.0,False,190.0
54080148.0,Stunning Swiss Chalet - 5 bed (3 ensuite) & 5 bath,Noel,2016-10-08,0.0,False,750.0
54091278.0,Maison villageoise au coeur du Chablais,Sandra,2017-09-20,92.0,True,120.0
54099860.0,Chambres d'hôte Der Stein aus Fluss,Ana,2022-01-02,100.0,False,72.0
54101958.0,Magnifique appartement avec parking et terrasse,Laura,2015-09-05,75.0,False,109.0
54107576.0,Charmante Chambre 1 pers.,Laurence,2016-03-03,85.0,False,48.0
54134573.0,Joli studio entièrement équipé,Sophie,2015-09-03,100.0,True,85.0
54153437.0,Charmant petit chalet en pleine nature,Rosie,2020-01-11,100.0,True,101.0
54153847.0,Studio,Base,2020-05-21,67.0,False,120.0
54160866.0,Le gîte du promeneur,Isabelle,2011-10-14,100.0,False,363.25
54195227.0,Cheerful 1 bedroom with free parking on site,Maddy,2014-07-20,85.0,False,60.0
54213513.0,Chaleureuse et panoramique Chambre - lit double,Laurence,2016-03-03,85.0,False,52.0
54217562.0,"Chaleureuse & panoramique,  lit double (séparable)",Laurence,2016-03-03,85.0,False,49.0
54223654.0,Jolie chambre avec jardin et piscine,Ginette,2016-06-03,95.0,False,62.0
54243948.0,Jolie chambre calme dans une maison vigneronne,Olivier Nicolas,2013-05-01,97.0,True,55.0
54268505.0,Grand Appartement de 3 chambres à coucher,Swiss,2019-02-19,89.0,False,150.0
54280009.0,Superbe appartement,Anas,2020-01-08,100.0,False,279.0
54302580.0,Chic 2 bedroom apartment near Chillion castle,Roman,2017-06-12,100.0,False,179.0
54340520.0,Charmant chambre dans un appartement en coloc,Shab,2022-01-17,25.0,False,65.0
54341306.0,Appartement duplex dans chalet montagne - Alpes,Marion,2016-05-05,0.0,False,174.25
54365148.0,113 * Very nice apartment close to the lake,Bomood,2013-08-25,95.0,False,173.0
54375358.0,2bdrm Rooftop in The Heart of Lausanne with AC,Valérie,2014-12-10,97.0,True,396.0
54401391.0,Magnifique chambre à Vevey,Zoé,2022-01-24,0.0,False,120.0
5.078186154904045e+17,Private studio with a view! Close to Nyon.,Marie,2017-10-23,88.0,True,100.0
5.1671257699519866e+17,Cozy apartment in Clarens with wonderful view,Vana,2011-09-14,0.0,False,82.0
5.426237657754564e+17,Chalet Apoutsiak,Delphine,2013-03-08,0.0,False,290.0
5.434921861772041e+17,The perfect home away from home,Stuart,2015-06-07,100.0,False,187.25
5.460840330955277e+17,Super appartement très calme et proche de tout!,Laurent,2014-08-09,86.0,False,187.25
5.461150669749395e+17,"Spacieux et lumineux 3,5 pièces à St-Légier",Lionel,2013-06-03,100.0,False,130.0
5.462185501250145e+17,Appartement indépendant dans un chalet authentique,Isabelle,2022-01-23,100.0,True,71.0
5.476636734334377e+17,Studio standard in Nyon city center,Annabel,2014-06-23,69.0,True,137.25
5.481712291126692e+17,Grande chambre | Malley/Prilly proche de Lausanne,Luis,2021-10-26,85.25,False,137.25
5.482456759590292e+17,Luxury Swiss chalet- 200m from piste,James,2017-05-20,75.0,False,258.0
5.497245006635668e+17,Nice Room in Lausanne,Eva,2013-12-03,97.0,True,90.0
5.504867874831978e+17,Charming Top floor 4 BR apartment 190m2 with amazi,Moriya,2012-06-28,51.0,True,177.0
5.506011172584143e+17,Joli appartement 3 pièces aux pieds des pistes,Laurent,2016-05-16,100.0,False,180.0
5.525472304397339e+17,Superbe Luxury appartement with Jacuzzi & lac view,Jean-Claude,2019-03-08,80.0,False,180.0
5.5345498023448115e+17,Studio apartment - 5 min from the lake,Annabel,2014-06-23,69.0,True,105.0
5.5366260943000096e+17,"2 pièces parfaitement équipé, avec vue et parking",Jenny,2016-09-13,100.0,True,105.0
5.562105964403564e+17,"Riviera Charm, Spacious, Panoramic balcony view",Elaine,2016-03-21,0.0,False,126.0
5.562809215862789e+17,Superbe studio de vacances à Villars,Michel,2016-02-09,0.0,False,80.0
5.5634900974883923e+17,P’tit Chalet pour de bons moments,Déborah,2013-07-24,85.0,True,101.0
5.563716403251135e+17,Appartement de standing en résidence calme,Céline,2015-06-09,46.25,False,125.0
5.5693481959325606e+17,Stylish Apartment with Lake View - Montreux,Roman,2017-06-12,100.0,False,193.0
5.5693550774550266e+17,Urban style 3-bedroom apartment,Roman,2017-06-12,100.0,False,193.0
5.5700831742496806e+17,Bright studio in the center of Montreux,Roman,2017-06-12,100.0,False,153.0
5.570517071313986e+17,Anémone 11,Bernadette,2018-07-12,94.0,False,162.0
5.576284447953568e+17,"Appartement luxueux avec vue180, billard & jacuzzi",Sophie,2015-07-15,97.25,False,156.0
5.5794927255847194e+17,Appartement central cosy et fonctionnel 3,Beatriz,2016-07-06,95.0,False,116.0
5.586058573867953e+17,"Spacieuse chambre d'hôtes, entrée indépendante",Maud,2022-02-09,95.0,True,70.0
5.598328736369281e+17,Montreux Balcony Retreat - Lake Proximity,Rita,2022-02-10,100.0,False,111.0
5.614683934233283e+17,Le toit de Chardonne - Entre Alpes et lac Léman,Bertrand,2022-02-13,100.0,True,361.0
5.615612285298897e+17,Joli appartement à côté de la gare de Lausanne,Erickson Darlan,2013-04-04,78.0,False,130.0
5.6172763363881126e+17,Panoramic 3BD Dream Family Villa in Montreux,Julian,2015-09-09,100.0,False,566.0
5.623111614453825e+17,Jolie chambre dans un appartement à la campagne,Guillaume,2019-11-14,35.0,False,185.25
5.627268178230677e+17,Les jardins du Vailloud 1,Christophe,2016-02-16,90.0,True,40.0
5.6276300524983226e+17,1 Bedroom for 2 & Self Check-in!,Rita,2022-02-10,100.0,False,100.0
5.6284675628166886e+17,Les jardins du Vailloud,Christophe,2016-02-16,90.0,True,35.0
5.634986817365051e+17,Private Room to rent - balcony - kitchen,Wajih,2015-05-21,19.0,False,50.0
5.636708472928792e+17,Chambre  au calme à la campagne,Didier,2017-08-24,95.0,False,49.0
5.636913891962135e+17,"Quille du Diable,L' Ours Bleu,B&B,Les Diablerets,",Arlette Et Philippe,2015-11-30,93.0,True,205.0
5.6382531654011936e+17,"Chambre ""Bitter"" L'Ours Bleu, B&B, Les Diablerets",Arlette Et Philippe,2015-11-30,93.0,True,175.0
5.6403069133857664e+17,"""les Diablotins"" L'Ours Bleu, B&B, les Diablerets",Arlette Et Philippe,2015-11-30,93.0,True,131.0
5.6410856163370874e+17,Country side family place. 2 rooms for B&B,Elizabeth,2015-12-28,100.0,False,50.0
5.6516829350425165e+17,Leysin: superbe studio en résidence « Evasion »,Danijela,2015-05-01,79.75,False,144.25
5.6567815545271123e+17,5* Cosy and charming 3 bedroom apt 15’ from Gstaad,Frederic,2016-07-28,36.0,False,321.0
5.658887060214661e+17,Lovely room with a lake and mountain view,Habiba,2021-12-02,90.0,True,75.0
5.663799161826174e+17,Maison Neve 2.5 Zi. mit Terrasse und Garten,Neve,2019-01-15,100.0,False,102.0
5.672437759997726e+17,Apartment with stunning view! Ski-in/out,Zsofia,2016-10-10,93.0,False,284.0
5.6736675283713664e+17,"Chambre dans villa à Lausanne/près EHL, Nestlé",Lena,2016-04-03,90.0,True,47.0
5.6775192676682906e+17,Appartement serein et spacieux,Sky-Zone Attitude,2021-04-26,100.0,False,235.0
5.701287163041052e+17,Studio in a hotel,Sereina,2017-10-12,95.5,False,171.5
5.71554553617195e+17,Studio chez un vigneron au village,Christine,2018-09-24,99.0,True,120.0
5.731116490441412e+17,"Petit Rubis de Villars, 3 pièces, 84m2, terrasse",Rachel,2015-06-30,100.0,False,150.0
5.735884792180696e+17,Lovely bedroom close to train station,Cris,2014-08-05,99.0,True,72.0
5.7371161820764064e+17,"Charmant appartement, prêt EPFL et UNIL",Lionel,2022-03-02,75.0,True,88.0
5.744378399954343e+17,"Spacious apartment, spectacular panoramic views",Will,2015-12-29,100.0,True,107.5
5.7445822997114874e+17,Casa privada - ubicación ideal para conocer Suiza,Nico,2017-03-27,93.5,False,107.5
5.757918603419697e+17,Superbe appartement ensoleillé et au calme,Nicolas,2017-01-23,82.0,False,152.5
5.758177559279014e+17,Clarens: Bel appartement de 2.5p à 4 min du lac.,Gilles,2018-12-11,84.0,True,120.0
5.775345879031415e+17,Beautiful 3-bed apartment - 5 minutes to the lake,Annabel,2014-06-23,69.0,True,247.75
5.779775671594538e+17,Magnifique appartement avec jacuzzi près de EPFL,Lyudmyla,2022-03-01,100.0,True,330.0
5.787923341845569e+17,Family House near Lake Leman and vineyards,Isabel Mestres,2014-05-26,77.0,False,255.25
5.795755194169709e+17,Centrally located apartment with pool and parking,Katerina,2016-06-20,75.0,True,450.0
5.797117197618253e+17,Appartement au coeur de Lavaux,Camille,2022-03-09,33.0,False,91.0
5.801046413298968e+17,Schöne Wohnung mit Blick auf Murtensee und Alpen,Eliane,2015-02-17,100.0,True,150.0
5.80763227925068e+17,Chambre d'hôte salle de bain privée (2-4 pers),Gioia,2017-07-09,100.0,True,80.0
5.826135491609463e+17,Gstaad Ski: Luxury 2 bedroom apartment,Chris,2013-10-20,67.0,False,285.0
5.833941264655474e+17,"Logement, Bord du Lac et centre-ville",Christine,2017-06-05,100.0,False,145.0
5.844345836067479e+17,Joli appartement au calme,Thibaut,2013-11-18,100.0,True,115.0
5.846467687558552e+17,"Cozy apartment 2 minutes from the lake, calm area",Kelly,2015-03-31,93.5,False,82.5
5.851178766363661e+17,Appartement avec parking gratuit sur place,Roberto,2019-04-29,94.0,True,70.0
5.853576178654492e+17,Maisonnette historique,Jean Marc,2021-11-21,100.0,False,80.0
5.856352343587628e+17,4 beds under-the-roof loft and private bathroom.,Elena,2013-08-07,80.0,True,65.0
5.865747707862538e+17,Superbe duplex avec vue imprenable sur les alpes,Ruth Et William,2016-06-08,100.0,False,160.0
5.874508899787315e+17,"Entre ville et campagne, appartement cosy avec vue",Cathy,2011-08-14,0.0,False,93.75
5.883798378427538e+17,La Maison des Roses et du Palmier,Camille,2014-05-18,49.5,False,108.75
5.89156112206844e+17,Charmant logement avec piscine en pleine campagne,Fabien,2022-02-01,0.0,False,100.0
5.903939085477327e+17,logement cosy avec poêle et jardin,Sara,2013-10-12,98.0,True,130.0
5.916180813631512e+17,Chambre en plein centre d'Yvonand,Audrey,2021-07-01,78.0,False,87.0
5.916879389367293e+17,Charmant appartement au centre ville de Lausanne,Alexandre,2018-10-14,78.0,False,87.0
5.918240681336493e+17,Joli petit appartement au coeur de Vevey,Giulietta,2019-07-17,78.0,False,87.0
5.927148590898263e+17,Chambre d'hôtes pour 2 voyageurs ( lits superposé),Luis,2022-03-28,90.0,True,45.0
5.93232623605588e+17,Riviera  : nice place in the Lavaux,Carlos,2019-10-29,99.0,True,70.0
5.938655974961859e+17,Joli appartement avec vue sur le lac leman,Ten,2014-10-09,25.0,False,103.0
5.941834722853998e+17,Chambre dans maison entre Moudon et Lausanne,Vincent,2014-03-03,81.0,False,80.0
5.948972878897075e+17,Joli appart avec parking gratuit 3min de la gare,Valérie-Frederic,2011-07-13,100.0,False,114.0
5.954311975389601e+17,Proche Lausanne: Studio bien équipé,Martin,2016-06-16,100.0,False,118.0
5.967026217977935e+17,"Super duplex, piscine privée, chauffée, vue unique",Bogomil,2022-04-03,100.0,True,599.0
5.968102041917582e+17,Appartement familial à deux pas de Beaulieu,Maïla,2021-08-06,89.0,False,190.0
5.969787721839773e+17,Chambre près du lac et centre  balcon et jardin,Cosette,2015-07-12,80.0,True,80.0
5.975867938760704e+17,Luxury chalet! -ideal for 2 families,Yasmine,2017-11-09,98.0,True,102.5
5.977052885191835e+17,"Chambres d'hôtes, vues sur le Mont-Blanc et Genève",Marc,2022-04-04,60.0,False,92.0
5.97900509834422e+17,Convenient private small room in Chavornay,Alexandra,2013-01-15,99.0,True,48.0
5.990923496947652e+17,Quartier très calme et chaleureux,Daly,2016-09-03,100.0,False,35.0
5.996429311435592e+17,Cérémonia 1 by Interhome,Melinda - Interhome Group,2016-10-28,94.0,False,236.0
6.012099273017892e+17,Full appartement with nice view over the lake,Habiba,2021-12-02,90.0,True,170.0
6.013797204878607e+17,Chalet isolé et plein de charme,Martina,2014-11-25,86.0,False,120.0
6.014758876192052e+17,Spacious 4-bedroom home 10-min walk from the lake,Alastair,2015-10-18,100.0,False,399.0
6.021971409284645e+17,Appartement cosy proche transport,Asma,2020-07-27,21.0,False,120.25
6.025544409923668e+17,Awesome studio in Lausanne - 194000,Homenhancement,2019-07-05,59.0,False,85.0
6.026091804069354e+17,Lovely modern apartment with view on the Alps,Mariska,2017-06-02,100.0,False,120.25
6.026464342146506e+17,"Loft cosy de charme, vue à couper le souffle.",Olivier,2020-01-18,71.0,False,190.0
6.026565609374327e+17,Apartment in the center of Lausanne - 905000,Homenhancement,2019-07-05,59.0,False,146.0
6.02684152774249e+17,"Between lake and city center, an ideal place to be",Thierry,2016-04-05,97.0,True,60.0
6.028240177883355e+17,Appartement traversant avec grand séjour et balcon,Denis,2015-05-28,30.0,False,65.0
6.0363472974955e+17,Nice tiny studio close to all commodities,Enrico,2022-04-12,71.5,False,117.75
6.039740199240675e+17,Spacious 2 bedroom apartment with mountain views,Claire,2016-10-04,100.0,False,200.0
6.047662308573846e+17,Chalet La Grange by Interhome,Melinda - Interhome Group,2016-10-28,94.0,False,265.0
6.049087713456198e+17,"Stylish studio in Sallaz, Lausanne - 715000",Homenhancement,2019-07-05,59.0,False,92.0
6.049131172172357e+17,Eco-friendly 1 bedroom flat in Lausanne - 815000,Homenhancement,2019-07-05,59.0,False,133.0
6.070099802196685e+17,Luxurious 2 bedroom apartment in modern chalet,Caitlin,2014-02-08,42.0,False,220.0
6.083858135737032e+17,Charming Ski-in/Out Chalet w stunning view of alps,Tiara,2014-01-24,46.5,False,350.0
6.084709630687117e+17,3 bedroom chalet with stunning views,Karen,2015-04-14,0.0,False,300.0
6.090820194733436e+17,Magnifique villa dans cadre bucolique,Silvia,2014-05-11,50.0,False,150.0
6.093513928579428e+17,Ideally located 1 br + kitchen with stunning view!,Amber,2019-02-19,61.0,False,227.5
6.097712211487727e+17,Résidence Bristol 4 by Interhome,Melinda - Interhome Group,2016-10-28,94.0,False,316.0
6.100482292351131e+17,Eco-friendly room few steps away from the lake,Niccolo,2015-06-16,100.0,True,144.0
6.104470081342707e+17,Studio au centre de Lausanne,Tiana,2014-08-14,71.0,False,97.0
6.106327410704475e+17,Gabriel 🤍 : belle chambre d'hôte avec vue,Sonia,2017-01-01,99.0,False,60.0
6.112328562758898e+17,Chalet Pierre Fleur by Interhome,Melinda - Interhome Group,2016-10-28,94.0,False,469.0
6.11375483232796e+17,muy céntrico a todo,Paul,2022-04-23,0.0,False,83.0
6.115444768746177e+17,Lausanne superbe Studio au cœur de la ville,Ronan,2020-01-12,66.0,False,100.0
6.13211919517285e+17,Riviera Room with Panoramic Views,Elaine,2016-03-21,0.0,False,180.0
6.136329972427909e+17,Charmant logement de vacances à Leysin-Village,Roland,2022-04-26,86.0,False,110.0
6.142681280309871e+17,"À l'étape rêvée, charme, calme et nature",Noëlle,2020-02-14,100.0,False,120.0
6.148374453396242e+17,Grande chambre/Magnifique villa au calme,Marie Solange,2022-04-28,87.0,False,70.0
6.148606335874728e+17,105*  Stunning new studios by the lake near Lausan,Bomood,2013-08-25,95.0,False,110.0
6.148935032528283e+17,Beautiful 2 bedroom flat - One family at a time,Patricia,2018-01-14,95.5,False,150.0
6.150530530207763e+17,Cozy apartment Lausanne Lake view,Julien - Rent To Go Sàrl,2017-02-22,100.0,False,70.0
6.15760253711936e+17,Charming house close to the lake Leman for 1 guest,Beatrix,2018-10-12,0.0,False,68.0
6.16562710796042e+17,Superbe villa familiale avec vue sur lac+montagnes,Vinciane,2016-07-23,75.0,False,230.0
6.166653081026449e+17,Chambre dans un Apprtement à clarens a la gare,Ahmed,2021-12-01,75.0,False,140.0
6.177697588334444e+17,"« Les Bouvreuils », un petit coin de paradis.",Sandra,2018-08-31,77.5,False,159.0
6.178656085811954e+17,Appartement spacieux avec vue sur le Lac et garage,Margaux,2015-06-02,77.5,False,90.0
6.179786315564648e+17,Modern & stylish flat with garden & view !,Mickael,2012-10-21,73.0,True,87.25
6.185486902225857e+17,Bedroom and private bathroom (2),Dinah,2020-12-08,62.0,False,50.0
6.188318138022591e+17,Chambre Centre Lausanne.,Paulo,2022-05-03,100.0,False,50.0
6.201119656879418e+17,very central ROOM with a stunning lake view,Aymen,2015-08-09,80.0,False,62.0
6.202866091959355e+17,"2 rooms, one big w balcony. near lake and train",Tamara,2015-11-24,94.0,False,112.0
6.207997637907357e+17,Cosy appart proche du centre ville,Lola,2016-10-26,29.0,False,125.5
6.210106496669366e+17,"Superbe appartement avec vue, 3 chambres.",Ahmed,2018-06-06,94.0,True,250.0
6.223154868823181e+17,Chambre - salle de bain privée/Magnifique villa,Marie Solange,2022-04-28,87.0,False,78.0
6.224370589561108e+17,Morges centre historique: Attique avec mezzanine,François,2016-09-27,0.0,False,163.25
6.224841104253011e+17,Chalet in Lausanne with river in garden,Vivian,2015-08-23,100.0,True,350.0
6.227303477828279e+17,"Superbe appartement avec Véranda, centre lausanne",Aymen,2015-08-09,80.0,False,150.0
6.229733329431277e+17,Yverdon-les-Bains Chambre cosy A 7 min du centre,Sabrine,2020-06-15,95.0,True,75.0
6.231504333396934e+17,Studio cosy avec jardin - Lausanne,Roxane,2016-10-05,100.0,False,100.0
6.236941503875729e+17,Le charme sous les combles,Vincent,2020-10-27,79.0,False,145.0
6.238115714758811e+17,St-Légier. Superbe deux pièces au cœur du village,Antonio,2016-10-14,93.0,False,110.0
6.24243800975698e+17,Chambre a louer vacance,Diana,2016-08-10,50.0,False,85.0
6.251365279125724e+17,Agréables chambres d’hôtes situées dans un village,Marie-Claire,2022-04-19,50.0,False,75.0
6.258787952274575e+17,"5 Schlafzimmer, 160m², 10 Personen (Chalet Les Jumelles)",Pays-D'Enhaut Région,2019-11-20,80.0,False,310.0
6.260275611881528e+17,Appartement en plein centre ville,Anaïs,2015-09-24,82.5,False,190.0
6.266354342488952e+17,Lovely 1-Bedroom loft w/ free parking on premises,Bertrand,2021-11-27,100.0,True,105.0
6.26854678181967e+17,Superbe appartement avec parking gratuit.,Juliet,2012-01-30,100.0,False,100.0
6.279477282402289e+17,Superbe appartement en résidence,Chanthy & Micha,2013-08-14,87.25,False,97.0
6.281866278391619e+17,Flatsharing at Student Village EPFL,Luca,2022-05-16,100.0,False,23.0
6.28257229839294e+17,Villa familiale avec jardin proche de Lausanne,Camille,2014-04-02,87.25,False,97.0
6.287605691416979e+17,Appartement avec vue lac au centre de Montreux,Ezio,2016-11-15,100.0,False,108.25
6.28811683888833e+17,"Rare Gem, spacious 2-bedroom flat in Lausanne",Alexandre,2014-08-19,55.0,False,160.0
6.2882271538793e+17,Verseau (avec piscine intérieure),Bernadette,2018-07-12,94.0,False,108.25
6.302339197442602e+17,"Lutry, le calme à 10 min de Lausanne",Rodolph,2015-04-17,66.5,False,155.0
6.304323392113569e+17,"Superbe appart avec vue, situation exceptionnelle",Emmanuel,2022-05-05,67.0,False,150.0
6.307955043729605e+17,Charming Forest-Lake Chalet,Jack,2014-08-10,50.0,nan,200.0
6.311924628991448e+17,Bright Ski Chalet-Style Apartment in Swiss Alps,Jacqueline,2022-05-20,51.25,False,141.5
6.315164350246399e+17,Superbe appartement à 5 mn de Lausanne,Nathalie,2016-08-07,59.5,False,171.75
